{
  "version": 1,
  "id": "platformerActors",
  "mode": "hires",
  "color": 7,
  "origin": { "x": 0, "y": 0 },
  "hitbox": { "offsetX": 4, "offsetY": 1, "width": 16, "height": 20 },
  "frames": [
    { "id": "idle", "data": [0,24,0,0,60,0,0,126,0,0,219,0,1,255,128,3,255,192,3,60,192,3,126,192,3,255,192,1,255,128,0,126,0,0,60,0,0,102,0,0,195,0,1,129,128,3,0,192,6,0,96,12,0,48,24,0,24,48,0,12,96,0,6] },
    { "id": "step", "data": [0,24,0,0,60,0,0,126,0,0,219,0,1,255,128,3,255,192,3,60,192,3,126,192,3,255,192,1,255,128,0,126,0,0,60,0,0,102,0,0,195,0,1,129,128,3,0,192,6,0,96,24,0,24,48,0,12,96,0,6,48,0,12] }
  ],
  "animations": {
    "idle-right": { "frames": ["idle"], "speed": 8, "loop": true },
    "idle-left": { "frames": ["idle"], "speed": 8, "loop": true },
    "run-right": { "frames": ["idle", "step"], "speed": 5, "loop": true },
    "run-left": { "frames": ["step", "idle"], "speed": 5, "loop": true },
    "jump-right": { "frames": ["step"], "speed": 8, "loop": true },
    "jump-left": { "frames": ["step"], "speed": 8, "loop": true }
  },
  "initialAnimation": "idle-right"
}
